Security Requirement Family,Security Requirement Identifier,Security Requirement Type,Security Requirement Description,Recommended Implementation Guidance,User Questions,Answer Type,Answer Content,Video,Documentation Required?,Additional Text,Notes,,
Configuration Management,3.4.7,Derived,"Restrict, disable, and prevent the use of nonessential programs, functions, ports, protocols, and services.","After determining what is essential for system functionality, [Company Name] restricts, disables, and prevents the use of nonessential programs, functions, ports, protocols, and services.","After determining what is essential for system functionality, does the organization restrict, disable, and prevent the use of nonessential programs, functions, ports, protocols, and services?",boolean,yes/no,CVXs-NZ1SHk,Y,"Provide a copy of your Ports, Protocols and Services Policy",,,
Configuration Management,3.4.8,Derived,"Apply deny-by-exception (blacklist) policy to prevent the use of unauthorized software or deny-all, permit-by-exception (whitelisting) policy to allow the execution of authorized software.","[Company Name] implements a deny-all, permit-by-exception (whitelisting) policy to allow for the execution of authorized software. Additionally, strict firewall rules are in place to restrict port access and user control. ","Does the organization implement a deny-all, permit-by-exception (whitelisting) policy to allow for the execution of authorized software? Additionally, are strict firewall rules  in place to restrict port access and user control?",boolean,yes/no,FWCnD0yYk5U,N,,,,
Configuration Management,3.4.9,Derived,Control and monitor user-installed software.,"User-installed software is strictly prohibited. [Company Name] implements a deny-all, permit-by-exception (whitelisting) policy to allow for the execution of authorized software. Baseline configurations changes are reviewed and approved via a Configuration Control Board (CCB) and deviations from baseline configurations are documented accordingly. ","Is user-installed software is strictly prohibited? Does [Company Name] implement a deny-all, permit-by-exception (whitelisting) policy to allow for the execution of authorized software? Are baseline configurations changes  reviewed and approved via a Configuration Control Board (CCB) and deviations from baseline configurations are documented accordingly?",boolean,yes/no,dCiOgYbSZhs,Y,Provide a copy of your System Use Policy,,,
Identification and Authentication,3.5.1,Basic,"Identify information system users, processes acting on behalf of users, or devices.","Using a centralized management system, [Company Name] creates unique individual accounts that are deprovisioned automatically when an individual leaves.","Using a centralized management system, does the organization create unique individual accounts that are deprovisioned automatically when an individual leaves?",boolean,yes/no,,N,,,,
Identification and Authentication,3.5.2,Basic,"Authenticate (or verify) the identities of those users, processes, or devices, as a prerequisite to allowing access to organizational information systems.","[Company Name] maintains an access control  list of authorized users,  defining their roles and responsibilities as well as syncing with system, application and data layers. All account requests must be authorized before access is granted. Using a centralized management system, [Company Name] creates unique individual accounts that are deprovisioned automatically when an individual leaves.","Does the organization maintain an access control  list of authorized users,  defining their roles and responsibilities as well as syncing with system, application and data layers? Are all account requests authorized before access is granted? Using a centralized management system, does the organization create unique individual accounts that are deprovisioned automatically when an individual leaves?",boolean,yes/no,,N,,,,
Identification and Authentication,3.5.3,Derived,Use multifactor authentication for local and network access to privileged accounts and for network access to non-privileged accounts.,[Company Name] requires multifactor authentication for all privileged and non-privileged accounts accessing the information system.  ,Does the organization require multifactor authentication for all privileged and non-privileged accounts accessing the information system?,boolean,yes/no,,N,,,,
Identification and Authentication,3.5.4,Derived,Employ replay-resistant authentication mechanisms for network access to privileged and non-privileged accounts.,[Company Name] employs replay-resistant authentication mechanisms for all privileged and non-privileged accounts accessing the information system. ,Does the organization employ replay-resistant authentication mechanisms for all privileged and non-privileged accounts accessing the information system? ,boolean,yes/no,,N,,,,
Identification and Authentication,3.5.5,Derived,Prevent reuse of identifiers for a defined period.,"Using a centralized management system, [Company Name] creates unique individual accounts that are deprovisioned automatically when an individual leaves. Identifiers are not reused.","Using a centralized management system, does the organization create unique individual accounts that are deprovisioned automatically when an individual leaves and Identifiers are not reused?",boolean,yes/no,,N,,,,
Identification and Authentication,3.5.6,Derived,Disable identifiers after a defined period of inactivity.,[Company Name] monitors user accounts and identifiers for inactivity and disables account access to the information system after a predetermined time of inactivity.,Does the organization monitor user accounts and identifiers for inactivity and disable account access to the information system after a predetermined time of inactivity?,boolean,yes/no,,Y, Provide a copy of your Account Management Policy,,,
Identification and Authentication,3.5.7,Derived,Enforce a minimum password complexity and change of characters when new passwords are created.,"Using uppercase letters, lowercase letters, numbers, and special characters, [Company Name] requires the password length to be a minimum of [X] characters.","Using uppercase letters, lowercase letters, numbers, and special characters, does the organization require the password length to be a minimum of [X] characters?",boolean,yes/no,,Y,Provide a copy of your Password Policy,,,
Identification and Authentication,3.5.8,Derived,Prohibit password reuse for a specified number of generations.,Users may not use the same password for at least [X] iterations.,Does the organization ensure users may not use the same password for at least [X] iterations?,boolean,yes/no,,N,,,,
Identification and Authentication,3.5.9,Derived,Allow temporary password use for system logons with an immediate change to a permanent password.,[Company Name] only uses temporary passwords when a password reset is required.,Does the organization only use temporary passwords when a password reset is required?,boolean,yes/no,,N,,,,
Identification and Authentication,3.5.10,Derived,Store and transmit only encrypted representation of passwords.,"[Company Name] does not store passwords in reversible encryption form. Instead, passwords are stored as one-way hashes using AES 256 encryption.","Instead of storing passwords in reversible encryption form, are passwords stored as one-way hashes using AES 256 encryption?",boolean,yes/no,,N,,,,
Identification and Authentication,3.5.11,Derived,Obscure feedback of authentication information.,[Company Name] uses control mechanisms that inherently obscure feedback of authentication information.,Does the organization use control mechanisms that inherently obscure feedback of authentication information?,boolean,yes/no,,N,,,,
Incident Response,3.6.1,Basic,"Establish an operational incident-handling capability for organizational information systems that includes adequate preparation, detection, analysis, containment, recovery, and user response activities.","[Company Name] has developed an incident response plan, which specifically outlines requirements for handling of incidents involvoing CUI.","Has the organization developed an incident response plan, which specifically outlines requirements for handling of incidents involving CUI?",boolean,yes/no,54vO4mIGvPY,Y,Provide a copy of your Incident Response Plan,,,
Incident Response,3.6.2,Basic,"Track, document, and report incidents to appropriate officials and/or authorities both internal and external to the organization.","[Company Name] has developed an incident response plan, which specifically outlines requirements for tracking and reporting of incidents involving CUI.","Has the organization developed an incident response plan, which specifically outlines requirements for tracking and reporting of incidents involving CUI?",boolean,yes/no,Y1n1PytNqNA,N,,,,
Incident Response,3.6.3,Derived,Test the organizational incident response capability.,"[Company Name] has developed an incident response plan, which specifically outlines requirements for testing, reviewing, and improving incident response capabilities.","Has the organization developed an incident response plan, which specifically outlines requirements for testing, reviewing, and improving incident response capabilities?",boolean,yes/no,oak7JMgknU8,N,,,,
Maintenance,3.7.1,Basic,Perform maintenance on organizational information systems.,"[Company Name] performs regularly scheduled maintenance, to include manufacturer recommendations, on all equipment encompassing the information system. ","Does the organization perform regularly scheduled maintenance, to include manufacturer recommendations, on all equipment encompassing the information system?",boolean,yes/no,fJ9IlOMzj18,Y,Provide a copy of your System Maintenance Policy,,,
Maintenance,3.7.2,Basic,"Provide effective controls on the tools, techniques, mechanisms, and personnel used to conduct information system maintenance.","[Company Name] permits only authorized tools, authorized techniques, authorized mechanisms, and authorized personnel to be employed for system maintenance.","Does the organization permit only authorized tools, authorized techniques, authorized mechanisms, and authorized personnel to be employed for system maintenance?",boolean,yes/no,jRO2woTGGdw,N,,,,
Maintenance,3.7.3,Derived,Ensure equipment removed for off-site maintenance is sanitized of any CUI.,"Using established guidelines, [Company Name] must ensure any media removed for maintenance or disposal is properly sanitized.","Using established guidelines, does the organization ensure any media removed for maintenance or disposal is properly sanitized?",boolean,yes/no,pFElPjVCKO8,Y,Provide a copy of your Media Sanitzation Policy,,,
Maintenance,3.7.4,Derived,Check media containing diagnostic and test programs for malicious code before the media are used in the information system.,"Any media that is provided by authorized maintenance personnel for troubleshooting, diagnostics, or other maintenance activities must be run through an anti-virus/anti-malware program prior to use on the information system.","Does the organization ensure that any media that is provided by authorized maintenance personnel for troubleshooting, diagnostics, or other maintenance activities must be run through an anti-virus/anti-malware program prior to use on the information system?",boolean,yes/no,8kLsV_BLf94,N,,,,
Maintenance,3.7.5,Derived,Require multifactor authentication to establish nonlocal maintenance sessions via external network connections and terminate such connections when nonlocal maintenance is complete.,"[Company Name] controls remote access sessions by utilizing end-to-end encryption, implementing strict firewall rules, and running only essential applications. The connection must be terminated when nonlocal maintenance is complete.","Does the organization control remote access sessions by utilizing end-to-end encryption, implementing strict firewall rules, and running only essential applications and the connection  terminated when nonlocal maintenance is complete?",boolean,yes/no,RzyXx8UX2BQ,Y,Provide a copy of your Remote Access policy,,,
Maintenance,3.7.6,Derived,Supervise the maintenance activities of maintenance personnel without required access authorization.,[Company Name] monitors all maintenance activities of maintenance personnel.,Does the organization monitor all maintenance activities of maintenance personnel?,boolean,yes/no,vs4FlDAuYR0,N,,,,
Media Protection,3.8.1,Basic,"Protect (i.e., physically control and securely store) information system media containing CUI, both paper and digital.","[Company Name] protects information system media containing CUI, both paper and digital, via documented workflow, data access controls, and media protection policies and procedures.","Does the organization protect information system media containing CUI, both paper and digital, via documented workflow, data access controls, and media protection policies and procedures?",boolean,yes/no,wcGZLEemx2E,Y,Provide a copy of your CUI Media Protection Policy,,,
Media Protection,3.8.2,Basic,Limit access to CUI on information system media to authorized users.,[Company Name] only grants enough privileges to a system user to allow them to sufficiently fulfill their job duties.,Does the organization ensure it only grants enough privileges to a system user to allow them to sufficiently fulfill their job duties?,boolean,yes/no,IbAvBQkDdW4,N,,,,
Media Protection,3.8.3,Basic,Sanitize or destroy information system media containing CUI before disposal or release for reuse.,"[Company Name] ensures all information system media containing CUI will be sufficiently encrypted, erased, or destroyed to guarantee that no usable data is retrievable. ","Does the organization ensure all information system media containing CUI will be sufficiently encrypted, erased, or destroyed to guarantee that no usable data is retrievable?",boolean,yes/no,fBWxoMcHAGQ,N,,,,
Media Protection,3.8.4,Derived,Mark media with necessary CUI markings and distribution limitations.,[Company Name] ensures all media will be labeled with CUI markings and distribution limitations.,Does the organization ensure all media will be labeled with CUI markings and distribution limitations?,boolean,yes/no,LTAUn-IavPo,Y,Provide a copy of your Media Labeling Policy  and Procedures,,,
Media Protection,3.8.5,Derived,Control access to media containing CUI and maintain accountability for media during transport outside of controlled areas.,Only authorized individuals have access to media containing CUI. [Company Name] maintains a chain of evidence for any media removed from the information system.,Does the organization only authorize individuals have access to media containing CUI and  maintains a chain of evidence for any media removed from the information system?,boolean,yes/no,YaNcYhA90Wg,Y,Provide a copy of your Access Control Policy,,,
Media Protection,3.8.6,Derived,Implement cryptographic mechanisms to protect the confidentiality of CUI stored on digital media during transport unless otherwise protected by alternative physical safeguards.,[Company Name] ensures all media containing CUI is encrypted and/or physically locked prior to transport outside of controlled areas.,Does the organization ensure all media containing CUI is encrypted and/or physically locked prior to transport outside of controlled areas?,boolean,yes/no,htfIxQHApN0,N,,,,
Media Protection,3.8.7,Derived,Control the use of removable media on information system components.,[Company Name] requires that removable media must support physical encryption and key vaulting to ensure recoverability.,Does the organization require that removable media  support physical encryption and key vaulting to ensure recoverability?,boolean,yes/no,-fcYg0pyjrc,N,,,,
Media Protection,3.8.8,Derived,Prohibit the use of portable storage devices when such devices have no identifiable owner.,"[Company Name] authorizes the use of portable storage devices via established guidelines, but information system access will be restricted, monitored, and controlled.","Does the organization authorize the use of portable storage devices via established guidelines, but restrict, monitor, and control information system access?",boolean,yes/no,jg5U1GEBdbM,N,,,,
Media Protection,3.8.9,Derived,Protect the confidentiality of backup CUI at storage locations.,"Using an approved encryption method, [Compay Name] protects the confidentiality of backup CUI at storage locations. ","Using an approved encryption method, does the organization protect the confidentiality of backup CUI at storage locations?",boolean,yes/no,yOOxuUqGWqw,N,,,,
Personnel Security,3.9.1,Basic,Screen individuals prior to authorizing access to information systems containing CUI.,"[Company Name] screens individuals prior to authorizing access to the information system containing CUI in accordance with applicable federal laws, executive orders, directives, policies, regulations, standards, and guidance. ","Does the organization screen individuals prior to authorizing access to the information system containing CUI in accordance with applicable federal laws, executive orders, directives, policies, regulations, standards, and guidance?",boolean,yes/no,0Fenv0ykF70,Y,Provide a copy of your Personnel Security Policy,,,
Personnel Security,3.9.2,Basic,Ensure that CUI and information systems containing CUI are protected during and after personnel actions such as terminations and transfers.,"Within 24 hours of termination or transfer, [Company Name] will revoke any authenticators/credentials associated with the individual, retrieve all information system-related property from the individual, retain access to the information system formerly controlled by the individual, and notify the information security office and data owner of the change in authorization.","Within 24 hours of termination or transfer, does the organization revoke any authenticators/credentials associated with the individual, retrieve all information system-related property from the individual, retain access to the information system formerly controlled by the individual, or notify the information security office and data owner of the change in authorization?",boolean,yes/no,vEwSQIyIftI,Y,Provide a copy of your Account Management Policy,,,
Physical Protection,3.10.1,Basic,"Limit physical access to organizational information systems, equipment, and the respective operating environments to authorized individuals.","[Company Name] implements physical security via walls, fences, cameras, guards, locks, card readers, and keys.","Does the organization implement physical security via walls, fences, cameras, guards, locks, card readers, and keys?",boolean,yes/no,XALRwcZxoJQ,N,,,,
Physical Protection,3.10.2,Basic,Protect and monitor the physical facility and support infrastructure for those information systems.,"[Company Name] implements physical security via walls, fences, cameras, guards, locks, card readers, and keys.","Does the organization implement physical security via walls, fences, cameras, guards, locks, card readers, and keys?",boolean,yes/no,NXQj302yQms,N,,,,
Physical Protection,3.10.3,Derived,Escort visitors and monitor visitor activity.,[Company Name] escorts all visitors and monitors their activity at all times.,Does the organization escort all visitors and monitor their activity at all times?,boolean,yes/no,9tzj3SPI50A,N,,,,
Physical Protection,3.10.4,Derived,Maintain audit logs of physical access.,"In accordance with retention policies and procedures, [Company Name] maintains audit logs of physical access for authorized individuals as well as visitors.  ","In accordance with retention policies and procedures, does the organization maintain audit logs of physical access for authorized individuals as well as visitors?",boolean,yes/no,Zdqw-OptuPA,Y,Provide a copy of your Audit Retention Policy,,,
Physical Protection,3.10.5,Derived,Control and manage physical access devices.,"[Company Name] performs regularly scheduled maintenance, to include manufacturer recommendations, on all physical access devices encompassing the information system.","Does the organization perform regularly scheduled maintenance, to include manufacturer recommendations, on all physical access devices encompassing the information system?",boolean,yes/no,A7lcv5VRr-4,N,,,,
Physical Protection,3.10.6,Derived,"Enforce safeguarding measures for CUI at alternate work sites (e.g., telework sites).","All alternate work sites where CUI data is stored, processed, or transferred must meet the same physical security requirements as the primary work site.","Does the organization ensure all alternate work sites where CUI data is stored, processed, or transferred meet the same physical security requirements as the primary work site?",boolean,yes/no,jKscD4_FX-o,N,,,,
Risk Assessment,3.11.1,Basic,"Periodically assess the risk to organizational operations (including mission, functions, image, or reputation), organizational assets, and individuals, resulting from the operation of organizational information systems and the associated processing, storage, or transmission of CUI.","[Company Name] undergoes initial and periodic risk assessments. The potential Confidentiality, Integrity, Availability (CIA) impact is determined via FIPS 199.  The resulting Plan of Action and Milestones (POA&M) will be a living document and incorporated into a larger risk assessment profile for the information system.","Does the organization undergo initial and periodic risk assessments? Since the potential Confidentiality, Integrity, Availability (CIA) impact is determined via FIPS 199 will the organizations resulting Plan of Action and Milestones (POA&M)  be a living document and incorporated into a larger risk assessment profile for the information system? ",boolean,yes/no,D9iNYK552nc,Y,Provide a copy of your Risk Assesment Policy & Security Assessment Report,,,
Risk Assessment,3.11.2,Derived,Scan for vulnerabilities in the information system and applications periodically and when new vulnerabilities affecting the system are identified.,[Company Name] regularly conducts vulnerability scans on the information system. The resulting Plan of Action and Milestones (POA&M) will be a living document and incorporated into a larger risk assessment profile for the information system.,Does the organization regularly conduct vulnerability scans on the information system since the resulting Plan of Action and Milestones (POA&M) is a living document and incorporated into a larger risk assessment profile for the information system?,boolean,yes/no,P2KDvTQ-9ec,Y,Provide a copy of your Vulnerability Scanning Policy and Vulnerability Scans,,,
Risk Assessment,3.11.3,Derived,Remediate vulnerabilities in accordance with assessments of risk.,"Upon regcognition of any vulnerability, [Company Name] creates a Plan of Action and Milestones (POA&M) to address  remediation, mitigation, acceptance, or transference of said vulnerability risk. High findings will be prioritized.","Upon recognition of any vulnerability, does the organization create a Plan of Action and Milestones (POA&M) to address  remediation, mitigation, acceptance, or transference of said vulnerability risk and are high findings prioritized?",boolean,yes/no,KeVRX6qKW0c,Y,Provide a copy of your Plans or Actions and MIlestones (POA&M) ,,,
Security Assessment,3.12.1,Basic,Periodically assess the security controls in organizational information systems to determine if the controls are effective in their application.,"[Company Name] conducts periodic security assessments on a representative sample of the information system. This includes, but is not limited to, policies and procedures review, personnel interviews, vulnerability scans, audit log review, and penetration testing. ","Does the organization conduct periodic security assessments on a representative sample of the information system which  includes, but is not limited to, policies and procedures review, personnel interviews, vulnerability scans, audit log review, and penetration testing?",boolean,yes/no,8nw692CqWSU,Y,Provide a copy of your Securtiy Asessment Repot (SAR),,,
Security Assessment,3.12.2,Basic,Develop and implement plans of action designed to correct deficiencies and reduce or eliminate vulnerabilities in organizational information systems.,"Upon regcognition of any vulnerability, [Company Name] creates a Plan of Action and Milestones (POA&M) to address  remediation, mitigation, acceptance, or transference of said vulnerability risk. High findings will be prioritized.","Upon recognition of any vulnerability, does the organization create a Plan of Action and Milestones (POA&M) to address  remediation, mitigation, acceptance, or transference of said vulnerability risk and are high findings prioritized?",boolean,yes/no,9YTDumr7JiQ,Y,Plans or Actions and MIlestones (POA&M),"If this is something we create, should we require them to upload it?",9YTDumr7JiQ,https://youtu.be/9YTDumr7JiQ
Security Assessment,3.12.3,Basic,Monitor information system security controls on an ongoing basis to ensure the continued effectiveness of the controls.,"[Company Name] deploys continuous monitoring tools that are, at a minimum, able to monitor privileged access, permission changes, kernel modifications, and/or binary changes across the entire information system.","Does the organization deploy continuous monitoring tools that are, at a minimum, able to monitor privileged access, permission changes, kernel modifications, and/or binary changes across the entire information system?",boolean,yes/no,cfdO_281Gj0,Y,Provide a copy of your Continuous Monitoring Plan,,,
